{
  "version": 1,
  "name": "fox",
  "palette": "tangerine",
  "image": "fox-tangerine-cheerful.png",
  "frame": {
    "width": 32,
    "height": 32
  },
  "columns": 8,
  "frame_count": 33,
  "loops": {
    "idle": [
      [
        0,
        280
      ],
      [
        1,
        280
      ],
      [
        2,
        560
      ],
      [
        0,
        280
      ],
      [
        1,
        280
      ],
      [
        2,
        560
      ]
    ],
    "thinking": [
      [
        3,
        280
      ],
      [
        4,
        280
      ],
      [
        5,
        280
      ],
      [
        6,
        280
      ],
      [
        3,
        280
      ],
      [
        4,
        280
      ],
      [
        5,
        140
      ],
      [
        7,
        140
      ],
      [
        6,
        280
      ]
    ],
    "working1": [
      [
        8,
        140
      ],
      [
        9,
        140
      ],
      [
        10,
        280
      ],
      [
        11,
        140
      ],
      [
        12,
        140
      ],
      [
        13,
        280
      ],
      [
        8,
        140
      ],
      [
        9,
        140
      ],
      [
        10,
        280
      ],
      [
        11,
        140
      ],
      [
        14,
        140
      ],
      [
        13,
        280
      ]
    ],
    "working2": [
      [
        15,
        140
      ],
      [
        16,
        140
      ],
      [
        17,
        140
      ],
      [
        10,
        140
      ],
      [
        18,
        140
      ],
      [
        19,
        140
      ],
      [
        20,
        140
      ],
      [
        13,
        140
      ],
      [
        15,
        140
      ],
      [
        16,
        140
      ],
      [
        17,
        140
      ],
      [
        10,
        140
      ],
      [
        18,
        140
      ],
      [
        21,
        140
      ],
      [
        20,
        140
      ],
      [
        13,
        140
      ]
    ],
    "working3": [
      [
        22,
        140
      ],
      [
        23,
        140
      ],
      [
        17,
        140
      ],
      [
        24,
        140
      ],
      [
        25,
        140
      ],
      [
        26,
        140
      ],
      [
        20,
        140
      ],
      [
        27,
        140
      ],
      [
        22,
        140
      ],
      [
        23,
        140
      ],
      [
        17,
        140
      ],
      [
        24,
        140
      ],
      [
        25,
        140
      ],
      [
        28,
        140
      ],
      [
        20,
        140
      ],
      [
        27,
        140
      ]
    ],
    "needs_you": [
      [
        29,
        280
      ],
      [
        30,
        280
      ],
      [
        31,
        280
      ],
      [
        32,
        280
      ],
      [
        29,
        280
      ],
      [
        30,
        280
      ],
      [
        31,
        280
      ],
      [
        32,
        280
      ]
    ],
    "done": [
      [
        0,
        280
      ],
      [
        1,
        280
      ],
      [
        2,
        560
      ],
      [
        0,
        280
      ],
      [
        1,
        280
      ],
      [
        2,
        560
      ]
    ]
  }
}
