{
  "version": 1,
  "name": "giraffe",
  "palette": "marcel-rose",
  "image": "giraffe.png",
  "frame": {"width": 48, "height": 54},
  "columns": 8,
  "frame_count": 129,
  "loops": {
    "idle": [[0, 300], [1, 200], [2, 100], [3, 100], [4, 300], [5, 100], [6, 100], [7, 100], [1, 100], [0, 500], [8, 200], [9, 100], [10, 100], [11, 300], [12, 100], [13, 100], [14, 100], [8, 100], [15, 500], [16, 200], [17, 100], [18, 100], [4, 400], [19, 100], [7, 100], [20, 100], [21, 100], [0, 100], [21, 100], [22, 100], [21, 100], [8, 200], [9, 100], [10, 100], [11, 300], [23, 100], [24, 100], [14, 100], [8, 100], [0, 200]],
    "thinking": [[25, 300], [26, 200], [27, 100], [28, 100], [29, 400], [30, 100], [31, 100], [32, 100], [33, 200], [34, 300], [35, 200], [36, 100], [37, 100], [38, 100], [39, 100], [40, 200], [41, 100], [42, 100], [43, 100], [25, 200]],
    "working1": [[44, 100], [45, 100], [46, 100], [47, 100], [48, 100], [49, 100], [50, 100], [51, 400], [52, 100], [53, 100], [54, 100], [44, 100], [55, 100], [44, 100], [45, 200], [56, 100], [57, 100], [58, 100], [59, 100], [60, 100], [61, 100], [60, 200], [62, 100], [63, 100], [56, 100], [44, 100], [55, 100]],
    "working2": [[64, 100], [65, 100], [66, 100], [67, 100], [68, 100], [69, 100], [70, 100], [71, 400], [72, 100], [73, 100], [74, 100], [64, 100], [75, 100], [64, 100], [65, 100], [76, 100], [77, 100], [78, 100], [79, 100], [80, 100], [81, 100], [82, 100], [81, 200], [83, 100], [84, 100], [85, 100], [64, 100], [75, 100]],
    "working3": [[86, 100], [87, 100], [88, 100], [89, 100], [90, 100], [91, 100], [92, 100], [93, 400], [94, 100], [95, 100], [96, 100], [97, 100], [98, 100], [86, 100], [87, 200], [99, 100], [100, 100], [101, 100], [102, 100], [103, 100], [104, 100], [105, 200], [106, 100], [107, 100], [99, 100], [86, 100], [108, 100]],
    "needs_you": [[109, 200], [110, 100], [111, 100], [112, 100], [113, 100], [114, 100], [115, 100], [116, 200], [117, 100], [118, 100], [119, 100], [112, 100], [120, 200]],
    "done": [[0, 200], [121, 100], [122, 100], [123, 100], [124, 100], [125, 100], [126, 200], [127, 100], [128, 100], [0, 500]]
  }
}
